{
  "feedback_id": "FDB-20260918-0001",
  "task_id": "TASK-NB-20260918-013",
  "publish_id": "PUB-HIST-0025",
  "decision_id": "DEC-20260918-0001",
  "account_id": "ACCOUNT-DY-001",
  "campaign_category": "游戏",
  "content_angle": "B-产品差异",
  "prediction_vs_actual": [
    {
      "metric": "views",
      "prediction": 28000,
      "source": "account.performance.median_views",
      "actual": 49196,
      "delta_pct": 75.7,
      "verdict": "above_baseline"
    },
    {
      "metric": "engagement_rate",
      "prediction": 0.06,
      "source": "account.performance.avg_engagement_rate",
      "actual": 0.0742,
      "delta_pct": 23.7,
      "verdict": "in_line"
    },
    {
      "metric": "production_hours",
      "prediction": 3.5,
      "source": "account.production.avg_production_hours",
      "actual": 4.4,
      "delta_pct": 25.7,
      "verdict": "in_line"
    },
    {
      "metric": "revision_count",
      "prediction": null,
      "source": "no_baseline",
      "actual": 4,
      "delta_pct": null,
      "verdict": "no_baseline"
    },
    {
      "metric": "revenue",
      "prediction": 500,
      "source": "adtask.commercial.creator_fee",
      "actual": 500,
      "delta_pct": 0.0,
      "verdict": "in_line"
    }
  ],
  "what_worked": [
    "阅读超基线（实际 49196 > 预测 28000）"
  ],
  "what_failed": [
    "品牌修改 4 轮，超出预期"
  ],
  "errors": [
    {
      "type": "commercial",
      "detail": "品牌修改频繁：实际 4 轮（上限 未设）",
      "impact": "medium"
    }
  ],
  "confidence_verdict": "high-confidence-deviation",
  "next_recommendations": [
    "接单前要求品牌明确修改轮次上限",
    "品类「游戏」阅读超基线：可列为优先接单方向"
  ],
  "model_update_proposals": [
    {
      "target": "account.production.avg_production_hours",
      "from": 3.5,
      "to": 3.68,
      "method": "ema",
      "status": "proposed",
      "rationale": "生产成本复盘偏差（实际 4.4h vs 基线 3.5h，基于 1 例）"
    },
    {
      "target": "account.performance.median_views",
      "from": 28000,
      "to": 32239,
      "method": "ema",
      "status": "proposed",
      "rationale": "阅读复盘偏差（实际 49196 vs 基线 28000，基于 1 例）"
    },
    {
      "target": "account.performance.historical_campaigns",
      "from": "美妆短视频 ×6；健身课程 ×2",
      "to": "美妆短视频 ×6；健身课程 ×2；游戏 短视频 ×1",
      "method": "append",
      "status": "proposed",
      "rationale": "已发布 游戏 短视频 内容，追加历史样本（基于 1 例）"
    }
  ],
  "created_at": "2026-09-18T09:40:45.028575Z"
}
