{
  "feedback_id": "FDB-20260918-0001",
  "task_id": "TASK-NB-20260918-017",
  "publish_id": "PUB-HIST-0032",
  "decision_id": "DEC-20260918-0001",
  "account_id": "ACCOUNT-DY-001",
  "campaign_category": "健身",
  "content_angle": "C-场景植入",
  "prediction_vs_actual": [
    {
      "metric": "views",
      "prediction": 28000,
      "source": "account.performance.median_views",
      "actual": 31005,
      "delta_pct": 10.7,
      "verdict": "in_line"
    },
    {
      "metric": "engagement_rate",
      "prediction": 0.06,
      "source": "account.performance.avg_engagement_rate",
      "actual": 0.0773,
      "delta_pct": 28.8,
      "verdict": "in_line"
    },
    {
      "metric": "production_hours",
      "prediction": 3.5,
      "source": "account.production.avg_production_hours",
      "actual": 4.5,
      "delta_pct": 28.6,
      "verdict": "in_line"
    },
    {
      "metric": "revision_count",
      "prediction": null,
      "source": "no_baseline",
      "actual": 2,
      "delta_pct": null,
      "verdict": "no_baseline"
    },
    {
      "metric": "revenue",
      "prediction": 300,
      "source": "adtask.commercial.creator_fee",
      "actual": 300,
      "delta_pct": 0.0,
      "verdict": "in_line"
    }
  ],
  "what_worked": [],
  "what_failed": [],
  "errors": [],
  "confidence_verdict": "high-confidence-inline",
  "next_recommendations": [
    "人工复盘未发现需调整项（或数据不足，保持现状观察）"
  ],
  "model_update_proposals": [
    {
      "target": "account.production.avg_production_hours",
      "from": 3.5,
      "to": 3.7,
      "method": "ema",
      "status": "proposed",
      "rationale": "生产成本复盘偏差（实际 4.5h vs 基线 3.5h，基于 1 例）"
    },
    {
      "target": "account.performance.median_views",
      "from": 28000,
      "to": 28601,
      "method": "ema",
      "status": "proposed",
      "rationale": "阅读复盘偏差（实际 31005 vs 基线 28000，基于 1 例）"
    },
    {
      "target": "account.performance.historical_campaigns",
      "from": "美妆短视频 ×6；健身课程 ×2",
      "to": "美妆短视频 ×6；健身课程 ×2；健身 短视频 ×1",
      "method": "append",
      "status": "proposed",
      "rationale": "已发布 健身 短视频 内容，追加历史样本（基于 1 例）"
    }
  ],
  "created_at": "2026-09-18T09:40:45.040318Z"
}
