{
  "feedback_id": "FDB-20260918-0001",
  "task_id": "TASK-NB-20260918-007",
  "publish_id": "PUB-HIST-0013",
  "decision_id": "DEC-20260918-0001",
  "account_id": "ACCOUNT-XHS-001",
  "campaign_category": "母婴",
  "content_angle": "B-产品差异",
  "prediction_vs_actual": [
    {
      "metric": "views",
      "prediction": 6500,
      "source": "account.performance.median_views",
      "actual": 3011,
      "delta_pct": -53.7,
      "verdict": "below_baseline"
    },
    {
      "metric": "engagement_rate",
      "prediction": 0.08,
      "source": "account.performance.avg_engagement_rate",
      "actual": 0.2119,
      "delta_pct": 164.9,
      "verdict": "above_baseline"
    },
    {
      "metric": "production_hours",
      "prediction": 3,
      "source": "account.production.avg_production_hours",
      "actual": 4.6,
      "delta_pct": 53.3,
      "verdict": "above_baseline"
    },
    {
      "metric": "revision_count",
      "prediction": null,
      "source": "no_baseline",
      "actual": 3,
      "delta_pct": null,
      "verdict": "no_baseline"
    },
    {
      "metric": "revenue",
      "prediction": 60,
      "source": "adtask.commercial.creator_fee",
      "actual": 60,
      "delta_pct": 0.0,
      "verdict": "in_line"
    }
  ],
  "what_worked": [
    "互动率超基线（实际 0.2119 > 预测 0.08）"
  ],
  "what_failed": [
    "生产成本低估（实际 4.6h > 基线 3h）",
    "内容表现低于账号基线（阅读量需人工核对）",
    "品牌修改 3 轮，超出预期"
  ],
  "errors": [
    {
      "type": "production",
      "detail": "生产成本低估：实际 4.6h vs 基线 3h（delta +53%）",
      "impact": "high"
    },
    {
      "type": "prediction",
      "detail": "阅读低于账号基线：实际 3011 vs 预测 6500（delta -53.7%）",
      "impact": "medium"
    },
    {
      "type": "commercial",
      "detail": "品牌修改频繁：实际 3 轮（上限 未设）",
      "impact": "medium"
    }
  ],
  "confidence_verdict": "high-confidence-deviation",
  "next_recommendations": [
    "上调生产成本基线至 3.32h（见 model_update_proposals）",
    "该内容表现低于账号基线：接同类任务前先核对品类/角度与账号匹配度",
    "接单前要求品牌明确修改轮次上限"
  ],
  "model_update_proposals": [
    {
      "target": "account.production.avg_production_hours",
      "from": 3,
      "to": 3.32,
      "method": "ema",
      "status": "proposed",
      "rationale": "生产成本复盘偏差（实际 4.6h vs 基线 3h，基于 1 例）"
    },
    {
      "target": "account.performance.median_views",
      "from": 6500,
      "to": 5802,
      "method": "ema",
      "status": "proposed",
      "rationale": "阅读复盘偏差（实际 3011 vs 基线 6500，基于 1 例）"
    },
    {
      "target": "account.performance.historical_campaigns",
      "from": "护肤测评 ×5；美妆种草 ×3；探店 ×2",
      "to": "护肤测评 ×5；美妆种草 ×3；探店 ×2；母婴 图文 ×1",
      "method": "append",
      "status": "proposed",
      "rationale": "已发布 母婴 图文 内容，追加历史样本（基于 1 例）"
    }
  ],
  "created_at": "2026-09-18T09:40:45.010010Z"
}
