{
  "feedback_id": "FDB-20260918-0001",
  "task_id": "TASK-NB-20260918-005",
  "publish_id": "PUB-HIST-0010",
  "decision_id": "DEC-20260918-0001",
  "account_id": "ACCOUNT-DY-001",
  "campaign_category": "美妆",
  "content_angle": "B-产品差异",
  "prediction_vs_actual": [
    {
      "metric": "views",
      "prediction": 28000,
      "source": "account.performance.median_views",
      "actual": 50339,
      "delta_pct": 79.8,
      "verdict": "above_baseline"
    },
    {
      "metric": "engagement_rate",
      "prediction": 0.06,
      "source": "account.performance.avg_engagement_rate",
      "actual": 0.1339,
      "delta_pct": 123.2,
      "verdict": "above_baseline"
    },
    {
      "metric": "production_hours",
      "prediction": 3.5,
      "source": "account.production.avg_production_hours",
      "actual": 4.4,
      "delta_pct": 25.7,
      "verdict": "in_line"
    },
    {
      "metric": "revision_count",
      "prediction": 2,
      "source": "adtask.requirements.revision_limit",
      "actual": 4,
      "delta_pct": 100.0,
      "verdict": "above_baseline"
    },
    {
      "metric": "revenue",
      "prediction": 1200,
      "source": "adtask.commercial.creator_fee",
      "actual": 1080.0,
      "delta_pct": -10.0,
      "verdict": "in_line"
    }
  ],
  "what_worked": [
    "阅读超基线（实际 50339 > 预测 28000）",
    "互动率超基线（实际 0.1339 > 预测 0.06）"
  ],
  "what_failed": [
    "品牌修改 4 轮，超出预期",
    "结算低于报价（1080.0 < 1200）"
  ],
  "errors": [
    {
      "type": "commercial",
      "detail": "品牌修改频繁：实际 4 轮（上限 2）",
      "impact": "medium"
    },
    {
      "type": "commercial",
      "detail": "结算低于报价：实际 1080.0 < 报价 1200",
      "impact": "low"
    }
  ],
  "confidence_verdict": "high-confidence-deviation",
  "next_recommendations": [
    "接单前要求品牌明确修改轮次上限",
    "核对佣金/结算条件后再接同类任务",
    "品类「美妆」阅读超基线：可列为优先接单方向"
  ],
  "model_update_proposals": [
    {
      "target": "account.production.avg_production_hours",
      "from": 3.5,
      "to": 3.68,
      "method": "ema",
      "status": "proposed",
      "rationale": "生产成本复盘偏差（实际 4.4h vs 基线 3.5h，基于 1 例）"
    },
    {
      "target": "account.performance.median_views",
      "from": 28000,
      "to": 32468,
      "method": "ema",
      "status": "proposed",
      "rationale": "阅读复盘偏差（实际 50339 vs 基线 28000，基于 1 例）"
    }
  ],
  "created_at": "2026-09-18T09:40:45.004895Z"
}
