{
  "feedback_id": "FDB-20260918-0001",
  "task_id": "TASK-NB-20260918-004",
  "publish_id": "PUB-HIST-0008",
  "decision_id": "DEC-20260918-0001",
  "account_id": "ACCOUNT-ZH-001",
  "campaign_category": "数码",
  "content_angle": "C-场景植入",
  "prediction_vs_actual": [
    {
      "metric": "views",
      "prediction": 9000,
      "source": "account.performance.median_views",
      "actual": 16736,
      "delta_pct": 86.0,
      "verdict": "above_baseline"
    },
    {
      "metric": "engagement_rate",
      "prediction": 0.05,
      "source": "account.performance.avg_engagement_rate",
      "actual": 0.0985,
      "delta_pct": 97.0,
      "verdict": "above_baseline"
    },
    {
      "metric": "production_hours",
      "prediction": 2.5,
      "source": "account.production.avg_production_hours",
      "actual": 2.8,
      "delta_pct": 12.0,
      "verdict": "in_line"
    },
    {
      "metric": "revision_count",
      "prediction": null,
      "source": "no_baseline",
      "actual": 4,
      "delta_pct": null,
      "verdict": "no_baseline"
    },
    {
      "metric": "revenue",
      "prediction": 300,
      "source": "adtask.commercial.creator_fee",
      "actual": 300,
      "delta_pct": 0.0,
      "verdict": "in_line"
    }
  ],
  "what_worked": [
    "阅读超基线（实际 16736 > 预测 9000）",
    "互动率超基线（实际 0.0985 > 预测 0.05）"
  ],
  "what_failed": [
    "品牌修改 4 轮，超出预期"
  ],
  "errors": [
    {
      "type": "commercial",
      "detail": "品牌修改频繁：实际 4 轮（上限 未设）",
      "impact": "medium"
    }
  ],
  "confidence_verdict": "high-confidence-deviation",
  "next_recommendations": [
    "接单前要求品牌明确修改轮次上限",
    "品类「数码」阅读超基线：可列为优先接单方向"
  ],
  "model_update_proposals": [
    {
      "target": "account.performance.median_views",
      "from": 9000,
      "to": 10547,
      "method": "ema",
      "status": "proposed",
      "rationale": "阅读复盘偏差（实际 16736 vs 基线 9000，基于 1 例）"
    },
    {
      "target": "account.performance.historical_campaigns",
      "from": "耳机测评 ×4；数码好物 ×3",
      "to": "耳机测评 ×4；数码好物 ×3；数码 图文回答 ×1",
      "method": "append",
      "status": "proposed",
      "rationale": "已发布 数码 图文回答 内容，追加历史样本（基于 1 例）"
    }
  ],
  "created_at": "2026-09-18T09:40:45.001613Z"
}
