{
  "feedback_id": "FDB-20260918-0001",
  "task_id": "TASK-NB-20260918-013",
  "publish_id": "PUB-HIST-0024",
  "decision_id": "DEC-20260918-0001",
  "account_id": "ACCOUNT-DY-001",
  "campaign_category": "游戏",
  "content_angle": "A-人群共鸣",
  "prediction_vs_actual": [
    {
      "metric": "views",
      "prediction": 28000,
      "source": "account.performance.median_views",
      "actual": 21238,
      "delta_pct": -24.1,
      "verdict": "in_line"
    },
    {
      "metric": "engagement_rate",
      "prediction": 0.06,
      "source": "account.performance.avg_engagement_rate",
      "actual": 0.1042,
      "delta_pct": 73.7,
      "verdict": "above_baseline"
    },
    {
      "metric": "production_hours",
      "prediction": 3.5,
      "source": "account.production.avg_production_hours",
      "actual": 5.1,
      "delta_pct": 45.7,
      "verdict": "in_line"
    },
    {
      "metric": "revision_count",
      "prediction": null,
      "source": "no_baseline",
      "actual": 0,
      "delta_pct": null,
      "verdict": "no_baseline"
    },
    {
      "metric": "revenue",
      "prediction": 500,
      "source": "adtask.commercial.creator_fee",
      "actual": 500,
      "delta_pct": 0.0,
      "verdict": "in_line"
    }
  ],
  "what_worked": [
    "互动率超基线（实际 0.1042 > 预测 0.06）"
  ],
  "what_failed": [
    "生产成本低估（实际 5.1h > 基线 3.5h）"
  ],
  "errors": [
    {
      "type": "production",
      "detail": "生产成本低估：实际 5.1h vs 基线 3.5h（delta +46%）",
      "impact": "high"
    }
  ],
  "confidence_verdict": "high-confidence-deviation",
  "next_recommendations": [
    "上调生产成本基线至 3.82h（见 model_update_proposals）"
  ],
  "model_update_proposals": [
    {
      "target": "account.production.avg_production_hours",
      "from": 3.5,
      "to": 3.82,
      "method": "ema",
      "status": "proposed",
      "rationale": "生产成本复盘偏差（实际 5.1h vs 基线 3.5h，基于 1 例）"
    },
    {
      "target": "account.performance.median_views",
      "from": 28000,
      "to": 26648,
      "method": "ema",
      "status": "proposed",
      "rationale": "阅读复盘偏差（实际 21238 vs 基线 28000，基于 1 例）"
    },
    {
      "target": "account.performance.historical_campaigns",
      "from": "美妆短视频 ×6；健身课程 ×2",
      "to": "美妆短视频 ×6；健身课程 ×2；游戏 短视频 ×1",
      "method": "append",
      "status": "proposed",
      "rationale": "已发布 游戏 短视频 内容，追加历史样本（基于 1 例）"
    }
  ],
  "created_at": "2026-09-18T09:40:45.027190Z"
}
