{
  "feedback_id": "FDB-20260918-0001",
  "task_id": "TASK-NB-20260918-011",
  "publish_id": "PUB-HIST-0021",
  "decision_id": "DEC-20260918-0001",
  "account_id": "ACCOUNT-XHS-001",
  "campaign_category": "食品",
  "content_angle": "A-人群共鸣",
  "prediction_vs_actual": [
    {
      "metric": "views",
      "prediction": 6500,
      "source": "account.performance.median_views",
      "actual": 6144,
      "delta_pct": -5.5,
      "verdict": "in_line"
    },
    {
      "metric": "engagement_rate",
      "prediction": 0.08,
      "source": "account.performance.avg_engagement_rate",
      "actual": 0.1353,
      "delta_pct": 69.1,
      "verdict": "above_baseline"
    },
    {
      "metric": "production_hours",
      "prediction": 3,
      "source": "account.production.avg_production_hours",
      "actual": 4.6,
      "delta_pct": 53.3,
      "verdict": "above_baseline"
    },
    {
      "metric": "revision_count",
      "prediction": null,
      "source": "no_baseline",
      "actual": 2,
      "delta_pct": null,
      "verdict": "no_baseline"
    },
    {
      "metric": "revenue",
      "prediction": null,
      "source": "no_baseline(未报价/置换)",
      "actual": null,
      "delta_pct": null,
      "verdict": "no_baseline"
    }
  ],
  "what_worked": [
    "互动率超基线（实际 0.1353 > 预测 0.08）"
  ],
  "what_failed": [
    "生产成本低估（实际 4.6h > 基线 3h）"
  ],
  "errors": [
    {
      "type": "production",
      "detail": "生产成本低估：实际 4.6h vs 基线 3h（delta +53%）",
      "impact": "high"
    }
  ],
  "confidence_verdict": "high-confidence-deviation",
  "next_recommendations": [
    "上调生产成本基线至 3.32h（见 model_update_proposals）"
  ],
  "model_update_proposals": [
    {
      "target": "account.production.avg_production_hours",
      "from": 3,
      "to": 3.32,
      "method": "ema",
      "status": "proposed",
      "rationale": "生产成本复盘偏差（实际 4.6h vs 基线 3h，基于 1 例）"
    },
    {
      "target": "account.performance.median_views",
      "from": 6500,
      "to": 6429,
      "method": "ema",
      "status": "proposed",
      "rationale": "阅读复盘偏差（实际 6144 vs 基线 6500，基于 1 例）"
    },
    {
      "target": "account.performance.historical_campaigns",
      "from": "护肤测评 ×5；美妆种草 ×3；探店 ×2",
      "to": "护肤测评 ×5；美妆种草 ×3；探店 ×2；食品 图文 ×1",
      "method": "append",
      "status": "proposed",
      "rationale": "已发布 食品 图文 内容，追加历史样本（基于 1 例）"
    }
  ],
  "created_at": "2026-09-18T09:40:45.023216Z"
}
