{
  "feedback_id": "FDB-20260918-0001",
  "task_id": "TASK-NB-20260918-006",
  "publish_id": "PUB-HIST-0011",
  "decision_id": "DEC-20260918-0001",
  "account_id": "ACCOUNT-XHS-001",
  "campaign_category": "家清洗护",
  "content_angle": "C-场景植入",
  "prediction_vs_actual": [
    {
      "metric": "views",
      "prediction": 6500,
      "source": "account.performance.median_views",
      "actual": 11881,
      "delta_pct": 82.8,
      "verdict": "above_baseline"
    },
    {
      "metric": "engagement_rate",
      "prediction": 0.08,
      "source": "account.performance.avg_engagement_rate",
      "actual": 0.167,
      "delta_pct": 108.8,
      "verdict": "above_baseline"
    },
    {
      "metric": "production_hours",
      "prediction": 3,
      "source": "account.production.avg_production_hours",
      "actual": 3.0,
      "delta_pct": 0.0,
      "verdict": "in_line"
    },
    {
      "metric": "revision_count",
      "prediction": null,
      "source": "no_baseline",
      "actual": 2,
      "delta_pct": null,
      "verdict": "no_baseline"
    },
    {
      "metric": "revenue",
      "prediction": null,
      "source": "no_baseline(未报价/置换)",
      "actual": null,
      "delta_pct": null,
      "verdict": "no_baseline"
    }
  ],
  "what_worked": [
    "阅读超基线（实际 11881 > 预测 6500）",
    "互动率超基线（实际 0.167 > 预测 0.08）"
  ],
  "what_failed": [],
  "errors": [],
  "confidence_verdict": "high-confidence-deviation",
  "next_recommendations": [
    "品类「家清洗护」阅读超基线：可列为优先接单方向"
  ],
  "model_update_proposals": [
    {
      "target": "account.performance.median_views",
      "from": 6500,
      "to": 7576,
      "method": "ema",
      "status": "proposed",
      "rationale": "阅读复盘偏差（实际 11881 vs 基线 6500，基于 1 例）"
    },
    {
      "target": "account.performance.historical_campaigns",
      "from": "护肤测评 ×5；美妆种草 ×3；探店 ×2",
      "to": "护肤测评 ×5；美妆种草 ×3；探店 ×2；家清洗护 图文 ×1",
      "method": "append",
      "status": "proposed",
      "rationale": "已发布 家清洗护 图文 内容，追加历史样本（基于 1 例）"
    }
  ],
  "created_at": "2026-09-18T09:40:45.006726Z"
}
